{
  "contract_version": "0.1.0",
  "revision": 0,
  "organization": {
    "id": "org-001",
    "name": "Fictional Example Company",
    "sector": "manufacturing"
  },
  "facilities": [
    {
      "id": "facility-001",
      "name": "Fictional plant",
      "jurisdiction": "CA-ON"
    }
  ],
  "jurisdictions": [
    "CA",
    "CA-ON"
  ],
  "reporting_period": {
    "start": "2025-01-01",
    "end": "2025-12-31"
  },
  "organizational_boundary": {
    "id": "boundary-001",
    "approach": "operational control (fixture only)",
    "facility_ids": [
      "facility-001"
    ],
    "exclusions": [],
    "evidence_ids": []
  },
  "evidence": [
    {
      "id": "ev-001",
      "source": {
        "locator": "fixture:meter-001",
        "title": "Fictional annual electricity record",
        "publisher": "Fictional Example Company",
        "accessed": "2026-10-04",
        "version": "fixture-1",
        "tier": 1
      },
      "method": {
        "name": "Synthetic meter reading fixture",
        "version": "fixture-1",
        "source": "fixture:meter-001"
      },
      "period": {
        "start": "2025-01-01",
        "end": "2025-12-31"
      },
      "unit": "kWh",
      "boundary_id": "boundary-001",
      "geography": "CA-ON",
      "quality": {
        "reliability": "unknown",
        "completeness": "complete",
        "fitness_notes": "Synthetic fixture, not independently verified."
      },
      "assumption": null,
      "uncertainty": {
        "kind": "unquantified",
        "description": "Fictional meter uncertainty is not quantified.",
        "value": null,
        "unit": null
      },
      "calculation": null
    }
  ],
  "results": [
    {
      "id": "res-001",
      "skill": "normalize-sustainability-data",
      "contract_version": "0.1.0",
      "status": "completed",
      "review_states": [
        "ANALYTICAL"
      ],
      "review_requirements": [],
      "metrics": [
        {
          "id": "metric-001",
          "name": "Recorded electricity",
          "value": 1000,
          "unit": "kWh",
          "period": {
            "start": "2025-01-01",
            "end": "2025-12-31"
          },
          "boundary_id": "boundary-001",
          "evidence_ids": [
            "ev-001"
          ],
          "method": {
            "name": "Synthetic meter reading fixture",
            "version": "fixture-1",
            "source": "fixture:meter-001"
          },
          "assumption": null,
          "uncertainty": {
            "kind": "unquantified",
            "description": "Fictional meter uncertainty is not quantified.",
            "value": null,
            "unit": null
          },
          "calculation": {
            "formula": "recorded quantity",
            "inputs": [
              "ev-001"
            ],
            "conversions": [],
            "rounding": "none"
          }
        }
      ],
      "evidence_ids": [
        "ev-001"
      ],
      "assumptions": [],
      "data_gaps": [],
      "diagnostics": [],
      "next_actions": []
    }
  ],
  "assumptions": [],
  "data_gaps": [],
  "review_requirements": [],
  "energy": [
    "res-001"
  ],
  "water": [],
  "materials": [],
  "waste": [],
  "ghg": {
    "scope_1": [],
    "scope_2": [],
    "scope_3": []
  },
  "suppliers": [],
  "targets": [],
  "risks": [],
  "opportunities": [],
  "projects": [],
  "frameworks": [],
  "emission_factors": []
}
